{
  "behavior_sha256": "43d5b3bef58a2a879f876b00507ac3354fc48cecdeb13e352b77a016d810b353",
  "deterministic": true,
  "evidence_id": "machine:Clearstra:exclusive-grant:live-probe",
  "machine_label": "live-machine-probe",
  "machine_status": "substantiated",
  "problems": [],
  "reproduction_command": "python scripts/condense/machine_probe_dataset.py --json",
  "schema": "helix-parity-machine-evidence/1.0",
  "source_lock_id": "source:Clearstra:exclusive-grant",
  "supporting_files": [
    "Clearstra/clearstra_markets/exclusive_grant.py",
    "Clearstra/schemas/order-grant.schema.json"
  ],
  "tests_passed": true
}
