{
  "behavior_sha256": "f3ba0a78701b3746209af73c918de1a2246b0ccfc6dbd07ffbb2069b8127af4d",
  "deterministic": true,
  "evidence_id": "machine:Attestra:policy-drift:live-probe",
  "machine_label": "live-machine-probe",
  "machine_status": "substantiated",
  "problems": [],
  "reproduction_command": "python scripts/condense/machine_probe_dataset.py --json",
  "schema": "helix-parity-machine-evidence/1.0",
  "source_lock_id": "source:Attestra:policy-drift",
  "supporting_files": [
    "Attestra/attestra_packs/policy_drift.py",
    "Attestra/schemas/packet-policy.schema.json"
  ],
  "tests_passed": true
}
