{
  "behavior_sha256": "f502d817bb02d154fb66646d7f2e6a8e2a7a89e942232f130bef782e6c726d62",
  "deterministic": true,
  "evidence_id": "machine:Routestra:waste-stack:live-probe",
  "machine_label": "live-machine-probe",
  "machine_status": "substantiated",
  "problems": [],
  "reproduction_command": "python scripts/condense/machine_probe_dataset.py --json",
  "schema": "helix-parity-machine-evidence/1.0",
  "source_lock_id": "source:Routestra:waste-stack",
  "supporting_files": [
    "Routestra/routestra_packs/waste_stack.py",
    "Routestra/schemas/candidate-waste.schema.json"
  ],
  "tests_passed": true
}
